<?xml version="1.1" encoding="UTF-8"?>

<etudiants xmlns:xsi="http://www.w3.org/2001/XMLSchema-instance"
xsi:noNamespaceSchemaLocation=
"./fichier.xsd">
    <etudiant cne="R136303724">
        <nom>boumaiza</nom>
        <prenom>abdellah</prenom>
        <date_de_naissance>2001-10-19</date_de_naissance>
        <notes>
            <note>
                <valeur>18</valeur>
                <matiere code="F1">
                    <nom>C#</nom>
                    <description>language de programmation</description>
                </matiere>
            </note>
        </notes>
    </etudiant>
    
</etudiants>